{
  "schema_version": "1.0.0",
  "context": {
    "workspace_id": "ws-demo",
    "session_id": "session-demo",
    "run_id": "run-demo",
    "document_id": "fs-demo",
    "base_document_version": "dv-7",
    "context_snapshot_id": "ctx-7",
    "template_id": "traditional-abap-five",
    "template_version": "1.0.0"
  },
  "id": "decision-1",
  "revision": 1,
  "content": {
    "id": "decision-1",
    "revision": 1,
    "text": "在同公司代码、供应商及币种边界内建议进行精确匹配。",
    "classification": "recommendation",
    "source_refs": [
      {
        "evidence_id": "ev-message-1",
        "locator": "message:msg-1#chars=0-20",
        "conclusion": "用户要求供应商未清项批量处理"
      }
    ],
    "depends_on": []
  },
  "confirmation": {
    "subject_id": "decision-1",
    "subject_revision": 1,
    "subject_hash": "fixture-hash-r1",
    "state": "unconfirmed",
    "actor_id": null,
    "confirmed_at": null,
    "record_id": null
  },
  "supersedes_id": null
}
